{
  "$schema": "https://json-schema.org/draft/2020-12/schema#",
  "$id": "https://jvndb.jvn.jp/schema/myjvn_statistics_1.0.json?20250419",
  "title": "MyJVN Statistics",
  "description": "Ver 1.0 (20250419): Representation of MyJVN Statistics as a JSON document.",
  "type": "object",
  "properties": {
    "generator": { "$ref": "#/$defs/generator_type" },
    "title": { "type": "string" },
    "link": { "type": "string", "format": "uri" },
    "updated": { "type": "string", "format": "date-time" },
    "lang": { "type": "string", "enum": ["ja", "en"] },
    "author": { "$ref": "#/$defs/author_type" },
    "distribution": { "$ref": "#/$defs/distribution_type" },
    "dataTotal": { "$ref": "#/$defs/dataTotal_type" },
    "dataFilter": { "$ref": "#/$defs/dataFilter_type" },
    "data": { "$ref": "#/$defs/data_type" },
    "status": { "$ref": "#/$defs/status_type" }
  },
  "$defs": {
    "engine_type": {
      "type": "object",
      "properties": {
        "version": { "type": "string" },
        "name": { "type": "string" }
      }
    },
    "generator_type": {
      "type": "object",
      "properties": {
        "engine": { "$ref": "#/$defs/engine_type" }
      }
    },
    "author_type": {
      "type": "object",
      "properties": {
        "name": { "type": "string" },
        "uri": { "type": "string", "format": "uri" }
      }
    },
    "tlp_type": {
      "title": "Traffic Light Protocol (TLP)",
      "description": "Provides details about the TLP classification of the document.",
      "type": "object",
      "required": ["label"],
      "properties": {
        "label": {
          "title": "Label of TLP",
          "description": "Provides the TLP label of the document.",
          "type": "string",
          "default": "CLEAR",
          "enum": ["AMBER", "AMBER+STRICT", "CLEAR", "GREEN", "RED"]
        },
        "url": {
          "title": "URL of TLP version",
          "description": "Provides a URL where to find the textual description of the TLP version which is used in this document. Default is the URL to the definition by FIRST.",
          "type": "string",
          "default": "https://www.first.org/tlp/",
          "format": "uri",
          "examples": ["https://www.us-cert.gov/tlp"]
        }
      }
    },
    "distribution_type": {
      "title": "Rules for sharing document",
      "description": "Describe any constraints on how this document might be shared.",
      "type": "object",
      "required": ["tlp"],
      "properties": {
        "text": {
          "title": "Textual description",
          "description": "Provides a textual description of additional constraints.",
          "type": "string",
          "minLength": 1,
          "examples": ["Copyright 2025, IPA, All Rights Reserved."]
        },
        "tlp": { "$ref": "#/$defs/tlp_type" }
      }
    },
    "dataTotal_type": {
      "type": "object",
      "properties": {
        "vulninfo": { "type": "integer" },
        "vendor": { "type": "integer" },
        "product": { "type": "integer" }
      }
    },
    "dataFilter_type": {
      "type": "object",
      "properties": {
        "nameType": { "type": "string" },
        "productName": { "type": "string" },
        "cweId": { "type": "string" },
        "metricType": { "type": "string" },
        "pubStartDate": { "type": "string" },
        "pubEndDate": { "type": "string" }
      }
    },
    "vulninfo_type": {
      "type": "object",
      "properties": {
        "1": { "type": "integer" },
        "2": { "type": "integer" },
        "3": { "type": "integer" },
        "4": { "type": "integer" },
        "5": { "type": "integer" },
        "6": { "type": "integer" },
        "7": { "type": "integer" },
        "8": { "type": "integer" },
        "9": { "type": "integer" },
        "10": { "type": "integer" },
        "11": { "type": "integer" },
        "12": { "type": "integer" }
      }
    },
    "data_type": {
      "type": "array",
      "minItems": 0,
      "items": {
        "type": "object",
        "properties": {
          "year": { "type": "integer" },
          "total_vulninfo": { "type": "integer" },
          "total_severity_critical": { "type": "integer" },
          "total_severity_high": { "type": "integer" },
          "total_severity_medium": { "type": "integer" },
          "total_severity_low": { "type": "integer" },
          "total_severity_none": { "type": "integer" },
          "vulninfo": { "$ref": "#/$defs/vulninfo_type" },
          "severity_critical": { "$ref": "#/$defs/vulninfo_type" },
          "severity_high": { "$ref": "#/$defs/vulninfo_type" },
          "severity_medium": { "$ref": "#/$defs/vulninfo_type" },
          "severity_low": { "$ref": "#/$defs/vulninfo_type" },
          "severity_none": { "$ref": "#/$defs/vulninfo_type" }
        },
        "required": [
          "severity_none",
          "total_severity_medium",
          "year",
          "total_severity_low",
          "severity_medium",
          "total_severity_high",
          "severity_low",
          "total_vulninfo",
          "vulninfo",
          "severity_high",
          "total_severity_none",
          "total_severity_critical",
          "severity_critical"
        ]
      }
    },
    "status_type": {
      "type": "object",
      "properties": {
        "version": { "type": "string" },
        "method": { "type": "string" },
        "feed": { "type": "string" },
        "lang": { "type": "string" },
        "retCd": { "type": "integer" },
        "retMax": { "type": "integer" },
        "errCd": { "type": "string" },
        "errMsg": { "type": "string" },
        "totalRes": { "type": "integer" },
        "totalResRet": { "type": "integer" },
        "firstRes": { "type": "integer" }
      },
      "required": ["version", "method", "feed", "retCd"]
    }
  }
}
